Title,Developer,Publisher,Release date NA,console,deck,guid,id,number_of_user_reviews,original_release_date,site_detail_url,game_rating,description
Olympic Gold: Barcelona '92,Tiertex,U.S. GoldSega JP,1992,gg,"The officially licensed game for of the 1992 Barcelona Olympics, Olympic was developed by U.S. Gold and released in 1992.",3030-10168,10168,0,,https://www.giantbomb.com/olympic-gold-barcelona-92/3030-10168/,," <div> Overview : Olympic Gold is an athletics game that was officially licensed for the Summer Games of 1992, held in Barcelona, Spain. Three different versions were released for the Sega Genesis/Mega Drive, Master System and portable Game Gear consoles.The game consists of seven separate events for players to compete in, either against the AI or up to four players. The events themselves display a wide range of the different types found in the real life Games, with the 100m, 110m Hurdles, Hammer, Archery, Pole Vault, Platform Diving and 200m Freestyle playable. </div> "
OutRun Europa,Probe Software,U.S. Gold,1992,gg,Drive through five levels in five different vehicles in this strange take on an arcade classic.,3030-8783,8783,0,,https://www.giantbomb.com/outrun-europa/3030-8783/,," <div> Overview : You escape a gang of thieves with five different vehicles at your disposal ranging from an (unlicensed) Corvette to a speedboat. The races are checkpoint based. The vehicles also have weapons built in. </div>  <div> Critical Reception : When the Game Gear version was released Electronic Gaming Monthly issued the following scores, 5,7,7,7 adding, ""...the action on this cart is almost as good as the arcade version. The ride in this game is smooth as silk and loads of fun to boot"". </div> "
Pac-Attack,Now Production,Namco,June 1994,gg,Pac-Man enters the lucrative world of falling block puzzles.,3030-13943,13943,0,1993-01-01,https://www.giantbomb.com/pac-attack/3030-13943/,ESRB: E," <div> Overview : Pac-Attack is a  Pac-Man spin-off, in the same vein as  Tetris and/or  Dr Mario. It is based somewhat on Namco's earlier game Cosmo Gang: The Puzzle, an Arcade and Super Famicom game released the previous year.Pac-Attack has been released on many different systems. The original version was released on the Super Nintendo and Sega Genesis in late 1993, closely followed by the Game Boy and Game Gear versions. An enhanced port was released on the Philips CD-i with the name Pac-Panic. It has also been released in many Namco and Pac-Man compilations, and the SNES version was rereleased on the Wii's Virtual Console.  </div>  <div> Gameplay :  Pac-Attack ScreenThe object of the game is to clear rows of blocks by getting them into straight lines; however, most of the falling puzzle pieces also have ghosts attached which take up valuable space where blocks could be stored. The solution to this problem is Pac-Man himself. Every once in a while a Pac-Man piece will fall, and all the ghosts on the board will turn blue. If the Pac-Man piece is situated in an area where he can easily catch any ghosts he will remove them from the grid.The game offers a standard ""Normal Mode"" in which the game plays out as described above, as well as a ""Puzzle"" mode in which the player is given a limited number of Pac-Man to eat the various ghosts. </div>  <div> Critical Reception : When the SNES version was released Electronic Gaming Monthly gave the review scores of 8,7,7,8 and 8 out of ten. Mike Weigand wrote, ""No, don't laugh, just try it! This game looks like nothing but once you start playing you will not be able to stop! The three games are addictive, and the two-player competition will have you and a friend playing until you drop!"". </div> "
Pac-Man,Namco,Namco,1991,gg,Tengen version of PAC-MAN for NES,3030-55512,55512,0,,https://www.giantbomb.com/pac-man/3030-55512/,,
Paperboy,Tengen,Tengen,1991,gg,"Also called (colloquially) Paperboy 64, this is a 3D reimagining of the classic arcade game. A PlayStation version was also planned, but never released.",3030-60211,60211,0,1999-10-31,https://www.giantbomb.com/paperboy/3030-60211/,ESRB: E,
Paperboy 2,"Manley and Associates, Inc.",Tengen,December 1993,gg,"Like in the original Paperboy, Paperboy 2 features a boy who delivers papers.",3030-17563,17563,0,,https://www.giantbomb.com/paperboy-2/3030-17563/,," <div> Overview : Paperboy 2 is the follow up to Atari's minor Arcade hit Paperboy and features identical gameplay. The goal is to deliver papers to all the houses specified by the player's route, while occasionally scoring bonuses by ""shooting"" excess papers at various targets along the way. The player must also avoid all the obstacles along the street, which range from traffic to dogs to RC cars to the Grim Reaper. The game was developed specifically for early 1990s computers and consoles; unlike the first, it never began life as an Arcade game.Unlike the original Paperboy, Paperboy 2 also features a girl who delivers papers. The player must also deliver papers to houses on either side of the street, whereas in the first the player simply had the one side to consider. Achieving certain objectives during the run, like foiling a criminal mid-robbery, will put the Paperboy on the front page of the newspaper that appears at the end of the stage. </div> "
Pete Sampras Tennis,Codemasters,Codemasters,1994,gg,"A tennis game by Codemasters for the Genesis and Game Gear, featuring professional tennis player Pete Sampras.",3030-15647,15647,0,,https://www.giantbomb.com/pete-sampras-tennis/3030-15647/,, <div> Overview : Pete Sampras Tennis is a tennis game developed and published by Codemasters for the Genesis and Game Gear platforms.The Genesis version of the game used what is called a J-Cart. The J-Cart contained two more controller ports on the front of the game cartridge itself allowing up to four players without the need of a multitap.  </div> 
PGA Tour Golf,Tengen,Tengen,1994,gg,"The first in a long-running series of golf simulation games by Electronic Arts, featuring officially-licensed courses and opponents from the PGA Tour.",3030-6799,6799,0,,https://www.giantbomb.com/pga-tour-golf/3030-6799/,," <div> Overview : PGA Tour Golf is a golf simulation game developed by Sterling Silver Software and published by Electronic Arts for MS-DOS PCs in 1990.The first in a long-running series of golf games released by Electronic Arts, PGA Tour Golf features official licensing with the PGA Tour organization and includes recreations of official Tournament Players Club courses, text commentary from featured professional golfers, and tournament statistics from real-life tournaments.Along with three recreated U.S. courses (TPC Avanel in Potomac, Maryland, PGA West Stadium Course in La Quinta, California, and TPC at Sawgrass in Ponte Vedra Beach, Florida), the game includes a fourth fantasy course (Sterling Shores).It was ported to the Sega Genesis and to both Amiga and Macintosh computers in 1991, to the Super Nintendo Entertainment System in 1992, to the Sega Master System in 1993, and to the Game Gear in 1994. The SMS and GG versions were published by Tengen, while the Amiga and SMS versions were only released in Europe. An expansion pack for the Amiga version (known as the Tournament Course Disk) was released in 1992, including three courses added in PGA Tour Golf II. The SNES version was released as part of Electronic Arts Sports Network (EASN) and replaced Sterling Shores with TPC at Eagle Trace from PGA Tour Golf II. </div> "
PGA Tour Golf II,Polygames,Time Warner Interactive,1995,gg,"The sequel to the Genesis version of Electronic Arts' first golf game, now with three additional courses and a new game mode based on the Skins Game tournament.",3030-21954,21954,0,,https://www.giantbomb.com/pga-tour-golf-ii/3030-21954/,," <div> Overview : PGA Tour Golf II is a golf simulation game developed by Polygames and published by Electronic Arts for the Sega Genesis in 1992. In North America, it was released as part of their EA Sports label. The game was later ported to the Game Gear in 1995, co-published by Time Warner Interactive.The sequel to the Genesis version of PGA Tour Golf, PGA Tour Golf II builds on the original's three main courses (TPC at Sawgrass, TPC at Avanel, and PGA West Stadium) with three new courses: TPC at Southwind (located in Memphis, Tennessee), TPC at Eagle Trace (located in Coral Springs, Florida), and TPC at Scottsdale (located in Scottsdale, Arizona). It also features higher-quality graphics and a new game mode based on the PGA Tour's Skins Game event.The new courses were later brought back to certain versions of the original game, with the Amiga version receiving these courses as an expansion disk (Tournament Course Disk) and the SNES version replacing the fantasy course with TPC at Eagle Trace. </div> "
PGA Tour 96,Ceris Software,Black Pearl Software,1996,gg,"The first annual installment of the seminal EA Sports golfing franchise. Each version of the game is unique, with most being direct ports of either PGA Golf Tour 486 or PGA Golf Tour III.",3030-1760,1760,0,,https://www.giantbomb.com/pga-tour-96/3030-1760/,ESRB: K-A," <div> Overview : PGA Tour 96 is a series of golf simulation games published by Electronic Arts (under the EA Sports label) for the Sony PlayStation, 3DO, Super Nintendo Entertainment System, Sega Genesis, Game Boy, Game Gear, and Windows PCs in 1995-1996.The fifth main installment of the PGA Tour series, PGA Tour 96 is the first in the series to use the shortened ""PGA Tour"" naming (combined with the yearly installment), the first in the series to be released on fifth-generation consoles, and the last in the series to be released on fourth-generation consoles). Unlike previous games in the series, PGA Tour 96 vastly differs by console, with most games instead being direct ports of PGA Golf Tour 486 or PGA Golf Tour III:The PS1 and PC versions, developed by Hitmen Productions, is the most original installment and builds on PGA Golf Tour 486 with a revamped UI and additional courses (including Spyglass Hill Golf Course in Pebble Beach, California).The 3DO and Genesis versions, developed by NuFx, Inc., are instead direct ports of PGA Golf Tour 486. It includes that game's visuals and interface, along with all three of that game's courses (although the Genesis version replaces TPC at Summerlin with Spyglass Hill Golf Course).The SNES version, developed by Halestorm, Inc. and co-published by Black Pearl Software, is instead a direct port of PGA Golf Tour III using the engine from their port of PGA European Tour. It includes that game's visuals and interface, along with all eight of that game's courses.The GB version, developed by Unexpected Development and co-published by Black Pearl Software, is instead a direct port of PGA Tour Golf III using the engine from their port of PGA European Tour. It includes five of that game's courses (TPC at Summerlin, TPC at Sawgrass, TPC at Avenel, TPC at The Woodlands, and TPC at Scottsdale).The GG version, developed by Ceris Software and co-published by Black Pearl Software, is an original port of PGA Tour Golf III. It includes only three of that game's courses: TPC at Sawgrass, TPC at Summerlin, and TPC at River Highlands. </div> "
Phantom 2040,Unexpected Development,Viacom New Media,June 1995,gg,"An action game that stars the 24th incarnation of The Phantom, a.k.a. The Ghost Who Walks, a masked vigilante determined to help restore order to a destroyed world. Based on the syndicated cartoon show that aired between 1994-96.",3030-2664,2664,0,,https://www.giantbomb.com/phantom-2040/3030-2664/,," <div> Overview : The PhantomPhantom 2040 is a side-scrolling action game released for the SNES and Sega Genesis. The game was developed by SunSoft (SNES) and Illusions Gaming (Genesis) and published by Viacom New Media. Phantom 2040 was released in 1995 in Japan, North America, and Europe.The game is based off of the television series of the same name (itself a spin-off of Lee Falk's classic comic series The Phantom), with a story that is similar to that of the television show's, but not directly taken from it. Phantom 2040 is an action game that takes place in the city of Metropia. The Super Nintendo version holds an average rating of 68% on Game Rankings, while there are no reviews registered for the Genesis version. </div>  <div> Gameplay : Phantom 2040 shares similarities with games such as Super Metroid.The gameplay of Phantom 2040 is similar to many other 2D side-scrolling action games. It contains many aspects similar to such games as Super Metroid and Bionic Commando. However, Phantom 2040 does have entirely unique gameplay mechanics as well. Phantom 2040 differs one way in that upgrading weapons is completely optional (unlike in Super Metroid, where there are set weapons and upgrades). Phantom 2040 also contains choices akin to moral choices (although based more on which direction to go).Phantom 2040 also focuses heavily on exploration (a key factor in Super Metroid). The player does not have to go a set way, for a set distance as in some games, but rather has each level to explore either direction, locating the objective. Most areas contain secret upgrades or health boosting items. Some levels even have gates that must be remotely unlocked via a corresponding number (each door has a number). Unlike in Super Metroid, most of the exploration is optional, as it veers off of the game's main objective. Most of the areas can be revisited later for more exploration.The game takes place across seven chapters, some of which are split into varying paths (of which the player has a choice). Each chapter takes the player to a completely new location. Depending on what decisions the player makes in the stages that a decision is available, some stages might not become available while others do. This means that the game has very many endings (over twenty unique endings). Some of these endings, however, aren't considered ""winning"" endings, and rather prompt the player to try again. </div>  <div> Plot : Rebbeca Madison is trying to take over the world; it's up to Phantom to stop her.It is the year 2040. The world is in a catastrophic state, due to environmental disasters. The Earth's ecological state hangs in the balance. Growing population and the deployment of robots called BIOTS (Biological Optical Transputer Systems) have caused the majority of people to scavenge for food, while the lucky few live in large, towering mansions.New York City has been renamed Metropia, and is the world's largest and most powerful city. Metropia houses the world's most powerful organization: Maximum, inc.. In addition to being the producer of BIOTS, Maximum holds high political standing due to their bribery of many leaders. Due to this influence, Maximum has transformed Metropia into a technologically-advanced city devoid of any animal or plant life. The insane leader of Maximum, Rebecca Madison, is intent on building a fortress called Cyberville where the wealthy can reside, safe from everything.Kit Walker is a Phantom (the 24th Phantom, in fact). The Phantoms work to restore order to the world, bringing an end to corruption, greed, and the violence that plagues the world. Kit Walker must now defeat Rebecca Madison to stop her from getting her ultimate goal of world domination. </div> "
Pinball Dreams,Spidersoft,GameTek,1994,gg,A multi-table pinball simulator released for numerous systems.,3030-6981,6981,0,,https://www.giantbomb.com/pinball-dreams/3030-6981/,ESRB: E," <div> Overview : Pinball Dreams (JP: Pinball Pinball) is a four table pinball simulator for computers and consoles, and the first game ever to be released by Digital Illusion CE AB, later on more known as DICE.The game consists of four tables, each with its own theme. Ignition (space), Steel Wheel (the wild west), Beatbox (music) and Nightmare (horror).Beatbox was removed as the game was ported to the GameBoy and Game Gear. </div> "
Poker Face Paul's Blackjack,Spidersoft,Adrenalin Interactive,1994,gg,A blackjack game in the Poker Face Paul series.,3030-44847,44847,0,,https://www.giantbomb.com/poker-face-paul-s-blackjack/3030-44847/,,
Poker Face Paul's Gin,Adrenalin Interactive,Sega,1994,gg,A gin rummy game in the Poker Face Paul series.,3030-44848,44848,0,,https://www.giantbomb.com/poker-face-paul-s-gin/3030-44848/,,
Poker Face Paul's Poker,Adrenalin Interactive,Sega,1994,gg,A poker game in the Poker Face Paul series.,3030-44849,44849,0,,https://www.giantbomb.com/poker-face-paul-s-poker/3030-44849/,,
Poker Face Paul's Solitaire,Spidersoft,Sega,1994,gg,A solitaire game in the Poker Face Paul series.,3030-44841,44841,0,,https://www.giantbomb.com/poker-face-paul-s-solitaire/3030-44841/,,
Predator 2,Teeny Weeny Games,Arena,1992,gg,An action game based on the movie of the same name.,3030-10343,10343,0,,https://www.giantbomb.com/predator-2/3030-10343/,," <div> Overview : Predator 2 is an action game based on the 1990 movie of the same name. Both the movie and the game adaptation places the alien hunter known as the Predator in the streets of LA, rather than the jungles of South America of the original film, and tasks detective Lt. Harrigan (played by Danny Glover in the movie) with stopping its homicidal onslaught.The first Predator 2 came out on PC in 1990 in  North America. Being a ""on-rails shooter"" of sorts, it was later ported to Amiga, Amstrad CPC,  Atari ST,  Commodore 64 and  ZX Spectrum in 1991. The game was also published by  Konami.The second game came out in 1991 for the  Sega Master System in  Europe and in 1992 for  Game Gear and Genesis/Mega Drive in Europe and North America. The game is a shooter and published by  Arena Entertainment, which had recently been acquired by Acclaim.   </div>  <div> Story (Genesis/Mega Drive version) :  The  Predator is in town with a few days to kill!!! It comes from a distant world... invisible, it's armed with powerful weapons unlike anything we know. It mercilessly stalks humans.. for sport. As Lt. Harrigan, it's up to you to rescue the innocent people from the clutches of the evil drug gangs-- before they become trophies of the Predator. Search the  streets,  rooftops, and  subways until you confront IT. The Predator is on the hunt... find him before he finds you! ~Passage from the back of the case   </div> "
Primal Rage,Probe Entertainment Ltd.,Time Warner Interactive,1995,gg,Giant beasts from different parts of the post-apocalyptic world fight each other for global domination in this violent 2D fighting game from Atari.,3030-14078,14078,0,,https://www.giantbomb.com/primal-rage/3030-14078/,ESRB: T," <div> Overview : Primal Rage is a 2D kaiju-themed fighting game developed and released by Atari for arcades in 1994.Players control one of seven giant beasts and must fight to conquer a post-apocalyptic neo-Stone Age Earth (known as ""Urth""). Like the large bosses in the early Mortal Kombat games (and the dinosaurs of Taito's Dino Rex), all beasts are rendered with stop-motion animation as model figures (while the small human followers are digitized actors). The game features numerous blood effects, including an end-of-round fatality system.Along with major arcade revisions (adding new special moves and abilities), the game received numerous ports for home consoles and handhelds in 1995. Other than the SNES version (which was ported by Bitmasters) and the PC version (which was ported by Teeny Weeny), all ports were done by Probe. They were released in North America and Europe by Time Warner Interactive for the Sony PlayStation, Sega Saturn, Super Nintendo Entertainment System, Sega Genesis, Sega 32X, Game Boy, Game Gear, Jaguar CD (exclusively in North America), 3DO (exclusively in North America), Amiga (exclusively in Europe for ECS and AGA systems), and PC (released for MS-DOS in CD-ROM format). It was also released in Japan for the PS1 (on December 13, 1996 by Time Warner Interactive) and Saturn (on February 26, 1998 by GameBank).Along with a short-lived toyline, it also received a four-issue comic book mini-series years after the game's original release. A sequel named Primal Rage II was in development in 1996, adding a new assortment of giant playable human ""Avatars"" (also rendered from model figures) to fight alongside the beasts. Although this sequel was canceled prior to release, some prototype boards from public tests (along with official cabinet artwork) of the sequel have been found, one of which is publically playable. Despite its cancellation, both games received an overarching novelization in 1997 (titled Primal Rage: The Avatars). </div>  <div> Gameplay : Primal Rage plays like a traditional 2D fighting game. Along with a joystick, each player has four buttons arranged in a square (horizontally from Quick to Fierce and vertically from High to Low). Pressing both High Quick and High Fierce simultaneously executes a powerful High Power attack, while pressing both Low Quick and Low Fierce simultaneously executes a powerful Low Power attack.Unlike traditional fighting games, where special moves are executed by first moving the joystick in a combination and then pressing one or more buttons, Primal Rage includes a system where special moves are executed by holding down certain buttons and then moving the joystick. Glorified execution moves, known as Fatalities, can also be performed this way at the end of the winning round. However, later arcade versions and most ports also include the traditional special move/fatality execution alongside this way.During the fight, human worshipers from the tribes of both fighters are scattered in the background. All characters have a special move (with unique combinations) which allows them to devour humans that enter the foreground, giving back some of their vitality. Devouring enemy worshipers also grant the player bonus points, while devouring friendly worshipers take away from the player's score.After defeating all seven opponents In the single-player campaign, the player has dominated Urth. But the beast still needs to prepare for one giant final endurance round to keep their place as ""king of the hill"". A bonus round occurs where the player has a limited amount of time to devour friendly worshipers (with no point loss) and flying pterodactyls for bonus health (that is used after the player's health has depleted in the final battle). During the final battle in the hellish ""dinosaur graveyard"", the player must survive against all seven opponents consecutively in one giant round. If the player loses both the initial health and the bonus health, they can immediately restore their character's initial health by continuing. The player is granted more points at the end of the campaign by using less continues. </div>  <div> Characters : The game includes seven playable beasts (six in the Game Boy and Game Gear versions). A final boss beast was planned for the final stage, but was scrapped and turned into an endurance match against the entire roster.Sauron and Blizzard are palette swaps of Diablo and Chaos. However, both Diablo and Chaos are smaller in size. Sauron (God of Hunger) Talon (God of Survival) Vertigo (Goddess of Insanity, unavailable in the GB and GG versions) Blizzard (God of Virtue) Chaos (God of Decay) Armadon (God of Life) Diablo (God of Destruction) </div> "
