Title,Developer,Publisher,Release date NA,console,deck,guid,id,number_of_user_reviews,original_release_date,site_detail_url,game_rating,description
The Simpsons: Bart vs. the Space Mutants,Arc Developments,Flying Edge,1992,gg,Bart starts a journey to stop aliens' evil plans and save the world using mostly slingshots and spray cans.,3030-16832,16832,0,1991-02-01,https://www.giantbomb.com/the-simpsons-bart-vs-the-space-mutants/3030-16832/,," <div> Overview : The Simpsons: Bart vs. the Space Mutants is the first video game adaptation of the hit 20th Century Fox animated comedy The Simpsons.Rather than based on any specific episode, the game uses various characters from the show to create a new story concerning the space mutants - a recurring race of hostile aliens who in the universe of the show only appear in movies - and Bart as the sole human aware of their presence, if not their intentions. It also borrows elements of the 1988 John Carpenter movie They Live, in particular the way Bart can see the aliens through special sunglasses. </div>  <div> Story :  Bart wakes up in the middle of the night and sees a UFO. He is the only one that knows about the alien invasion. Hence, he starts a journey to stop Aliens' evil plans and defend the earth. Although, this is the first Simpsons game, the plot has little to do with the show's material. Regardless, many of the show's characters make an appearance. </div>  <div> Gameplay : In each level, Bart is faced with various objectives that he has to accomplish and certain items that he has to collect before proceeding to the level boss. These objectives vary in each level, and most of them reflect Bart's personality in the show.Bart can activate X-Ray vision to identify humans who have been abducted by aliens. By jumping on them, Bart can collect letters that form the name of the level assistant. If he forms the whole name, then that character will provide assistance in fighting the level's boss. For instance, in the first level, if Bart collects all the letters of ""Maggie"", she will help him fight Nelson, the level's boss, by throwing Bowling balls.There are various items that Bart can buy and use as weapons or to cause a special event. These items include Slingshots, Sprays, Rockets, Whistles, Magnets, Coins, etc. Some of the items are used in many clever ways. For instance, if players blow the whistle in front of the retirement home, Grandpa Simpson will come out and start throwing money.The game is considered to be very difficult. The lack of saves, continues, or check points increase the game's challenge. In addition, for each life, Bart can only be hit two times before dying; players only start with three lives. Finally, most of the enemies can only be avoided, not killed.There are numerous small additions and details added to the game; for example, in the third level (The Carnival), Players can take part in most of the carnival activities. Players can even buy a magnet and use it to cheat in the ""spin the wheel"" minigame. </div>  <div> Levels : Location: SpringfieldBoss: Nelson MuntzHelper: Maggie </div> "
The Simpsons: Bart vs. the World,Arc Developments,Flying EdgeAcclaim JP,1993,gg,Follow up of Bart vs the Space Mutants with improved controls and longevity.,3030-11108,11108,0,1991-12-13,https://www.giantbomb.com/the-simpsons-bart-vs-the-world/3030-11108/,," <div> Critical Reception : When the Game Gear version was released in 1993 Electronic Gaming Monthly gave the review scores of 7,6,7 and 7 out of ten. Sushi-X, who gave a 7 wrote, ""This cart is a big improvement over previous Simpsons' titles for the Game Gear. The graphics are excellent and are very bright and colorful. The sounds are really good too. There is a lot more variety to the game play and the control is very responsive. Of course the humor of Bart and his wacky friends is rampant throughout the game. Overall this is another quality Game Gear cart and Simpsons' fans should take note"". </div> "
The Simpsons: Bartman Meets Radioactive Man,Teeny Weeny Games Ltd.,Flying Edge,1993,gg,"This bizarre game depicts Bart Simpson's ""Bartman"" alter-ego, originally a throwaway gag on a single episode, as an actual superhero with genuine powers, who must save his idol Radioactive Man from the Limbo Zone, and defeat the evil Brain-O the Magnificent.",3030-11462,11462,0,1992-12-14,https://www.giantbomb.com/the-simpsons-bartman-meets-radioactive-man/3030-11462/,,
Skweek,Loriciel,Victor,1991,gg,A puzzle action game from French studio Loriciel featuring the titular fuzzball as he runs around painting his world pink. Would be followed by Super Skweek.,3030-16991,16991,0,,https://www.giantbomb.com/skweek/3030-16991/,," <div> Overview : Skweek is a top-down action puzzle game from French developers Loriciel. It was initially released on the Amiga, Atari ST and Amstrad CPC computers, systems popular in Europe, and later ported to the PC Engine and Game Gear by Japanese company Victor Entertainment in 1991. The Game Gear version would then get ported to Europe and North America by Sega with the new name Slider.The goal in Skweek, similar to other puzzle games like Q*Bert, is to color in every block on the map from blue to pink. Skweek needs to avoid the various enemies on the map in order to complete his task. He can collect power-ups and point items, as well as finding shortcuts to the next level and a series of four collectible teddy bears which appear randomly around the stage. If Skweek finds all four bears, he can skip to the next stage without completing the one he is on. The game was followed by a graphically enhanced sequel: Super Skweek. </div> "
Solitaire FunPak,Beam Software,Interplay,1994,gg,"One of interplay's many compliation games, Solitaire FunPak featured 12 different solitaire-based card games to play.",3030-13411,13411,0,,https://www.giantbomb.com/solitaire-funpak/3030-13411/,, <div> Overview : Solitaire FunPak is a Solitaire compilation developed by Beam Software and published by Interplay for Game Boy and Game Gear platforms. </div> 
Poker Solitaire,Sankindo,Sega,1991,gg,Solitaire game for OUYA and iOS,3030-65329,65329,0,2013-10-07,https://www.giantbomb.com/poker-solitaire/3030-65329/,,
Sonic 2 In 1,Aspect,Sega,—,gg,A European exclusive compilation of two Sonic games on a single cartridge.,3030-58271,58271,0,,https://www.giantbomb.com/sonic-2-in-1/3030-58271/,," <div> Overview : Sonic 2 in 1 is a compilation of games developed by Aspect Co. (Sonic the Hedgehog 2) and Polygames/Sega Technical Institute (Sonic Spinball) and was published by Sega Europe for Game Gear.The game features two full Sonic the Hedgehog games on a single cartridge. Unlike other similar 2 in 1 packs, Sonic 2 in 1 does not have a menu to choose games. The game instead switched games when the system is power cycled.The two games included on the cartridge are:Sonic the Hedgehog 2Sonic the Hedgehog: Spinball </div> "
Sonic Blast Heroes,Aspect,Sega,"November 14, 1996",gg,Sonic Blast Man returns to arcades 17 years after his last outing.,3030-58909,58909,0,2011-02-25,https://www.giantbomb.com/sonic-blast-heroes/3030-58909/,,
Drift,SegaArc System Works,Sega,November 1995,gg,Drift is an XNA community game available over Xbox Live Marketplace. It is a collection of customizable ambient art.,3030-24554,24554,0,2008-11-12,https://www.giantbomb.com/drift/3030-24554/,,
Sonic Labyrinth,Minato Giken,Sega,November 1995,gg,"A Game Gear spin-off of the Sonic the Hedgehog series that focuses on maze exploration, as Sonic searches for the Chaos Emeralds to free him from wearing ""slow-down boots"".",3030-6222,6222,0,,https://www.giantbomb.com/sonic-labyrinth/3030-6222/,CERO: All Ages," <div> Overview : Sonic Labyrinth is a 2D isometric platformer developed and published by Sega for the Sega Game Gear in October 1995 (in Europe) and November 1995 (worldwide).A spin-off of the Sonic the Hedgehog series, Sonic Labyrinth puts the titular hedgehog in bumper-filled mazes (similar to pinball tables) as he navigates each maze to find all keys and reach the exit before the timer expires. However, Dr. Robotnik has secretly replaced his trademark shoes with ""slow-down boots"", negating his ability to run fast and jump and making him unable to remove the boots without energy from chaos emeralds. He can still use his Spin Dash ability to quickly navigate each maze.It was included as a hidden mini-game in the 2003 game Sonic Adventure DX: Director's Cut, in the 2004 compilation Sonic Mega Collection Plus, and in the 2005 compilation Sonic Gems Collection (as a limited ""demo""). It was also digitally re-released for the Nintendo 3DS (via Virtual Console) on May 2012 (in Japan and Europe) and June 2013 (in North America). </div> "
Sonic the Hedgehog,Ancient,Sega,December 1991,gg,A spelling game for the didj. Players race through the level collecting letters to spell a word.,3030-38273,38273,0,2008-04-30,https://www.giantbomb.com/sonic-the-hedgehog/3030-38273/,,
Sonic the Hedgehog 2,Aspect,Sega,"November 17, 1992",gg,"Run, jump and spin through levels as Sonic and Tails, in order to thwart the plans of the nefarious Dr. Robotnik and free the kidnapped animals! Released by Sega in 1992, Sonic the Hedgehog 2 is often considered one of the greatest platformers of all time.",3030-1662,1662,0,1992-10-16,https://www.giantbomb.com/sonic-the-hedgehog-2/3030-1662/,ESRB: E," <div> Overview : A year after the original Sonic the Hedgehog, Sonic the Hedgehog 2 burst on to the scene. Sonic 2 is very similar to the original, but builds on many of the concepts and ideas introduced in the first title while piling on nearly twice the number of levels. The most drastic change was the introduction of a sidekick, Miles ""Tails"" Prower. The new character allowed a simple 2-player competitive mode, borrowing levels from the single player to add a much needed multi-player component. Tails could also follow Sonic around in single player mode, and could be controlled by plugging in a second Genesis gamepad.Arguably the most dramatic improvement is the implementation of the Spin-dash. By ducking and pressing the jump button, Sonic would rev up in ball form. After revving up enough, the player could stop pressing down to get a burst of speed while staying rolled into a ball. Beyond those two additions, however, gameplay for Sonic the Hedgehog 2 remains relatively the same; the goal is still to get to the end of a level as quickly as possible, while destroying as many enemies and collecting as many rings as possible. Rather than having three acts and a boss fight (as in Sonic 1), Sonic 2 features only two acts per level, with some exceptions (Metropolis Zone features three acts, Sky Chase, Wing Fortress, and Death Egg all feature a single act each).Chaos Emeralds also returned from the original, offering up an additional 7th Emerald (instead of the original game's 6). The special stages were done on a endless half-pipe which Sonic ran forward on collecting rings and avoiding enemies. If he had enough rings when he hit the checkpoint then he would continue until eventually obtaining a Chaos Emerald. Collect all 7 and Sonic would be able to transform into Super Sonic. In this form Sonic becomes even faster and rather than his usual blue is colored a bright yellow. </div>  <div> Plot : Not content just exploring his home of South Island, Sonic the Hedgehog's adventures took him all over the globe. It was eventually he found himself at West-side Island, said to be home to a lost civilization. This civilization were given seven ""Chaos Emeralds"" of great power as a gift from the Gods. Eventually, this power corrupted the civilization, and this angered the Gods greatly. As punishment, they sealed the emeralds away in an alternate dimension called ""The Special Zone"".Intrigued, Sonic lands his biplane, the Tornado, on the island. It's here Sonic runs in to a shy, two-tailed fox named Miles - Sonic nicknames him ""Tails"" for obvious reasons. Tails, as it turns out, loves machinery, and he is fascinated by Sonic's plane. Before the two can get too acquainted, however, they hear an explosion in the distance. Doctor Ivo 'Eggman' Robotnik has followed Sonic to this island, and is tearing it apart looking for the Chaos Emeralds. He hopes they will act as an energy source for his greatest, most deadly creation: a giant, weaponized space station called the ""Death Egg."" Together, Sonic and Tails agree that Robotnik has to be stopped at all costs. </div>  <div> Special Stage : The Special Stage is played from behind Sonic in a 3D half-pipe. The player is given a target of the number of rings they have to collect as Sonic runs through the pipe whist avoiding the bombs. If the target is met then the stage continues, if not then the player returns to the level where they entered the Special Stage with a total of no rings. By meeting all the targets in the Special Stage, the stage is cleared and the player unlocks a Chaos Emerald. Each new Special Stage is harder than the one which preceded it and they have to be completed in order with no way to skip to the next one without completing the one previous.After collecting all 7 Chaos Emeralds, compared to the total of 6 found in the Master System version, Sonic gains the ability to change into Super Sonic after collecting 50 rings. When Sonic becomes his super form he is virtually invincible, running and jumping much higher than normal, only able to be killed by drowning, being crushed, falling off the screen or by running out of time in the level. This added speed comes at a price as it makes it almost impossible to do precise jumps due to the increased speed as well as loosing 1 ring a second whilst in super form; with Sonic reverting back to his normal self when the rings reach zero and effectively making him a sitting duck to enemies. </div>  <div> Two Player Versus Mode : Sonic 2 also included a two versus player mode where, playing as either Sonic or Tails, two players can have a split screen race on one of 3 different zones or a Special Stage. In the regular zone races, on either Emerald Hill Zone, Casino Night Zone or Mystic Cave Zone, players are ranked in 5 different areas with the highest score winning the round. On the Special Stage the winner is the one who collects the most rings. In the case of a tie in the regular zones a Special Stage is then ran to determine a winner. Two player mode also added a couple of new item boxes. One being a teleporter which switched the two players around, the other being a Dr. Robotnik item which damaged the player that found it. </div>  <div> Compatibility with Sonic & Knuckles : By slotting the Sonic the Hedgehog 2 cartridge into the top of the Sonic & Knuckles cartridge, the player will play as Knuckles instead of either Sonic or Tails. He can glide and climb walls but due to his inferior jumping ability some boss fights are more difficult as Knuckles.There are a few minor differences in the way Star Post checkpoints are handled however as when returning to a level after a Special Stage the player would keep the rings they had before they went in, whereas in the default game all rings were lost. The same applies when a life is lost.Some minor changes to levels were also made so the player could find extra secrets or shortcuts using Knuckles climbing and gliding abilities. </div>  <div> Re-Releases : The Genesis version of this game was re-released on:Sonic Compilation on the Mega Drive in EuropeSonic 3-in-1 on the Genesis in North AmericaSega Smash Pack 2 on the PCReal Arcade on the PCSonic Mega Collection on the Nintendo GamecubeSonic Mega Collection Plus on the PS2, Xbox and PCSonic Genesis Collection on the PS2 and PSPWii Virtual ConsoleXbox Live Arcade MarketplaceSonic's Ultimate Genesis Collection for Xbox 360 and PS3Sega Mega Drive and Genesis Classics Collection for PCSega 3D Classics for the Nintendo 3DSSega Forever for Mobile PlatformsSega Genesis Classics for Playstation 4 and Xbox OneSega Ages for the Nintendo Switch </div>  <div> Zones : Sonic the Hedgehog 2 has 11 zones, plus one special stage. This is twice as many as the original Sonic, which had 6 zones. However, a big difference this time around is that most of the zones have two acts instead of three. This is not a hard and fast rule though, as the Metropolis Zone has 3 acts and towards the end of the game Sky Chase Zone, Wing Fortress Zone and Death Egg Zone all have a single act. </div>  <div> Soundtrack : The first zone of Sonic 2 bares more than a passing resemblance to Green Hill Zone from the previous game. Emerald Hill is set inside a tropical resort, featuring palm trees, rolling green hills, and wildlife-themed enemies like monkeys, fish and bees. Dr. Robotnik appears here, driving a drill-based machine that he tries to ram in to Sonic. </div>  <div> Development History : This zone is set in a bustling industrial city that is flooded with a neon pink liquid. Sonic can survive while submerged in this, but only for a limited time since there are no air bubbles. Dr. Robotnik makes his appearance with a suction tube clipped onto the bottom of his ship, which he uses to extract toxic materials from the liquid below. The player must avoid his attacks while remaining on a series of platforms, which feature panels that will successively rotate. </div>  <div> Trivia : This zone is set in the ruins of a sinking city as it succumbs to the depths of a lake. The low routes lead deep under the surface and features a significantly higher level of challenge, so players are advised to keep their heads above water whenever possible. Robotnik appears here with a giant mallet attached to his ship, he will hit down on two columns that flank the player on either side of street, causing them to shoot out arrows. The player must use these arrows as platforms in order to be able to reach Robotnik and bring him down. </div>  <div> 8-bit Master System/Game Gear Game : This zone is set in a series of giant pinball tables, featuring flippers, bumpers and a number of slot machines. Dr. Robotnik appears here at the bottom of the last pinball table, with a set of electric pincers on the bottom of his ship. He uses this to drop bombs on the player, so staying on the ground is inadvisable. Instead, the player must spin dash up to, and utilize, the bumpers in order to hurl themselves at Robotnik. </div> "
Sonic Origins,Aspect,Sega,"November 23, 1993",gg,Sonic Origins is a compilation of classic Sonic the Hedgehog titles.,3030-82698,82698,0,2022-06-23,https://www.giantbomb.com/sonic-origins/3030-82698/,," <div> Overview : Sonic Origins was revealed as part of the 30th anniversary celebration on the Sonic Central livestream airing on May 27, 2021. No specific platforms were announced at the time. Although footage showed what appeared to be widescreen versions of most of the games (likely the Taxman remakes), those showing Sonic 3/Sonic & Knuckles were the original 4:3 format. Katie, the Sonic the Hedgehog social media manager, confirmed later that those games would also be widescreen.Games included in the collection are:Sonic the HedgehogSonic the Hedgehog 2Sonic the Hedgehog 3Sonic & KnucklesSonic CD </div> "
Sonic the Hedgehog: Spinball,Sega Interactive Development Division,Sega,September 1994,gg,"Sonic the Hedgehog infiltrates the secret lair of Dr. Robotnik, only to find himself at the mercy of Robotnik's ingenious Pinball Defense System!",3030-18592,18592,0,1993-11-15,https://www.giantbomb.com/sonic-the-hedgehog-spinball/3030-18592/,ESRB: E," <div> Overview : Watch out! Escape!Sonic the Hedgehog Spinball (known in Japan as Sonic Spinball) is a hybrid 2D platformer/pinball video game developed by Polygames and published by Sega for the Sega Genesis on November 23, 1993. The game was later ported to the Sega Game Gear (on September 1994, exclusively outside of Japan) and Sega Master System (exclusively in Europe on January 1995) by SEGA IDD.Players control Sonic the Hedgehog as a pinball (also controlling the various flippers around the stages), as he ventures through each of the four stages while collecting Chaos Emeralds and defeating the boss machines of Dr. Robotnik.The game is one of the two games to make use of elements from both the Sonic the Hedgehog and Adventures of Sonic the Hedgehog cartoon series (the other game being Dr. Robotnik's Mean Bean Machine). The story involves Sonic infiltrating Dr. Robotnik's diabolical lair (the Veg-O-Fortress) on Mt. Mobius (thwarting his latest plan to turn the animals of planet Mobius into robots). This time, he must make use of Dr. Robotnik's new Pinball Defense System to navigate the lair.The Genesis version was included in numerous compilations (including Sega Smash Pack, Sonic Mega Collection, Sonic Mega Collection Plus, Sonic Gems Collection as a limited ""demo"", and Sonic's Ultimate Genesis Collection). The GG version was included whole in Sonic Gems Collection and was also included as a hidden mini-game in the 2003 game Sonic Adventure DX: Director's Cut. The Genesis version was also digitally re-released for the Wii (via Virtual Console) on March 12, 2007, for the PC (via Steam) on September 13, 2010, and iOS devices on December 16, 2010. </div>  <div> Stages : There are four levels. In each level, the player has to collect all Chaos Emeralds to unlock the boss room. Defeating the boss clears the level. In between each level, players can enjoy bonus stages that consist of Sonic himself playing an actual pinball machine with three lives to complete a challenge, and which have slightly different physics from the main game. Each Bonus Stage plays at a specific time and do not have to be completed; even if the player loses at the Trapped Alive stage after completing the first level, they will still proceed to the Robo Smile stage after completing the second. </div> "
Sonic the Hedgehog: Triple Trouble,Aspect,Sega,November 1994,gg,"The fourth 8-bit platformer featuring Sonic the Hedgehog pits him and his buddy Tails against the triple threat of Dr. Robotnik, Knuckles the Echidna, and a new foe: the wily treasure hunter Nack the Weasel.",3030-13900,13900,0,1994-11-11,https://www.giantbomb.com/sonic-the-hedgehog-triple-trouble/3030-13900/,ESRB: K-A," <div> Overview : Sonic the Hedgehog: Triple Trouble (known in Japan as Sonic & Tails 2) is a 2D side-scrolling platformer developed by Aspect and published by Sega for the Sega Game Gear (in November 1993).The sequel to Sonic the Hedgehog Chaos, Triple Trouble pits Sonic and Tails against not only Dr. Robotnik, but both Knuckles the Echidna (who is duped by Robotnik into stealing the emeralds) and treasure hunter Nack the Weasel (named Fang the Sniper in the Japanese version, who sets out to take the emeralds for profit). Aspect would later make both a sequel (with both Sonic and Knuckles as protagonists) and a spin-off (an action-adventure platformer featuring Tails).The game was included as a hidden mini-game in the 2003 game Sonic Adventure DX: Director's Cut and in the 2005 compilation Sonic Gems Collection. It was also digitally re-released for the Nintendo 3DS (via Virtual Console) on March 2012. </div> "
