Title,Developer,Publisher,Release date NA,console,deck,guid,id,number_of_user_reviews,original_release_date,site_detail_url,game_rating,description
The Incredible Crash Dummies,Software Creations Ltd.,Acclaim,1992,gg,"The Incredible Crash Dummies capitalizes on the early '90s popularity of the Crash Dummy characters. Players are able to smash and trash the Dummies, running them through test tracks and stunts.",3030-20029,20029,0,,https://www.giantbomb.com/the-incredible-crash-dummies/3030-20029/,," <div> Overview : The Incredible Crash Dummies (known as ""The Incredible Crash Dummies: Slick Bouya no Daichousen"" in Japan. The subtitle roughly translates as ""Slick's Great Challenge"") is an action platformer game based on the Incredible Crash Dummies license, a toy series that became an animated TV show. The player controls Slick, one of the titular Incredible Crash Dummies, and must rescue Dr Zub from the evil Junkman before he can use the good Doctor's knowledge to create an army of robots.The game was released on many home systems of the era, some of which varied slightly in their presentation and gameplay.  </div>  <div> Game Boy Version : The Game Boy version of The Incredible Crash Dummies featured many different forms of gameplay, resembling more of a mini-game collection than its Super Nintendo counterpart. Players must either successfully crash the playable dummy, or successfully pass the Dummy through various levels. </div>  <div> Critical Reception : Five separate stunts await the Dummy for testing. The Roof Jump comprises of a vertical drop off the edge of a burning building. Players receive more points for each awning they are able to break, and for each fire hazard they are able to avoid. A target is painted on the sidewalk, which the Dummy must hit in order to progress to the next stage of testing.The Air Bumper stage puts the Dummy behind the wheel of a new car model, with improved air bumper safety features. The player must steer the car over air cans in order to inflate the bumper, while avoiding large pits on the test track, along with oil slicks that cause the Dummy's vehicle to spin out.The Ski Slope tests the Dummy's agility and reflexes, as trees must be avoided, and points are awarded for any jumps completed.The Dummy proceeds to enter the Bomb Factory, where the player must ensure the quality of bombs created by blowing out any lit fuses. Failing to do so on any three bombs will result in the stunt starting over. Conveyor belts move the bombs from the top of the screen to the bottom, with other various items. The Dummy is instructed to smash all of the other items with a mallet, ensuring that only quality tested bombs make it through the factory.The Cruise Missle stunt is an arcade style level, where the player navigates a space ship in an extremely low gravity environment. Changing the ship's trajectory requires rotating the vehicle and igniting the engine, creating a delicate balance between speed and maneuverability as the player is timed. The Dummy must crash the ship on yet another bulls eye, ending the stunt.After the end of each stunt, the Dummy's boss will critique the player's work. The Dummy receives cash if the stunt went as planned, and a small bonus if the boss was impressed. Three levels of difficulty are presented, with easy, normal, and hard, encouraging the player to revisit each stunt for more cash. </div> "
The Incredible Hulk,Probe Software,U.S. Gold,1995,gg,"The Incredible Hulk is a free roam, open world game, allowing the player to reek havoc on the streets of New York City while playing through the story of the movie.  ",3030-20891,20891,0,2008-06-05,https://www.giantbomb.com/the-incredible-hulk/3030-20891/,ESRB: T," <div> Overview : The Incredible Hulk was released on June 5, 2008 on consoles, and on June 10 for the PC. The Incredible Hulk is a free roaming, destructible world game, allowing the player to wreak havoc on the streets of New York City.The Incredible Hulk is your chance to guide Hulk's powerful rage towards his enemies who try to control him. </div>  <div> Gameplay : This installment of the Incredible Hulk is a spiritual successor to the previous title , The Incredible Hulk: Ultimate Destruction and resembles other MarvelHulk Vs Kyclopsgames such as Ultimate Spider-man. While roaming through the streets of New York City, the player can stop at certain checkpoints to either play story segments of the game or complete mini-games. Mini-games include time trials, a Crazy Taxi -esque mission, and dart throwing. Most moves are taken directly from the previous Hulk title, such as smashing a car to make gauntlets that can damage armored enemies and Hulk's thunderclap. A rage meter gives you access to powered up attacks. Fury and Gamma canisters are collectibles scattered throughout the city to increase your health and rage meters. There is also a standard warning level gauge that increases the amount of military that comes after you proportional to how muchA complete variety of destruction.damage you cause. This can be resolved by using one of the subway stations, the game's alternative mode of transportation around the city. As is typical of open world sandbox games, the Hulk will be able to romp freely through a monstrous, organic replica of New York City’s Manhattan borough. Touted as the ultimate playground with its capacity to sustain persistent and complete destruction, players will quickly discover an unlimited potential for chaos as they demolish entire buildings with their fists, use blown-out structures to access previously unreachable areas, rip passing vehicles in half, and effortlessly pluck streetlights out from the concrete before using it to bash enemies’ heads in. As you go about rampaging violently through the streets, you’ll slowly build up a rage meter that will allow the Hulk to upgrade his arsenal of moves and learn additional abilities. Also, in addition to the main storyline, players will be able to complete a variety of side quests and mini-games as well.Hulk preparing for the kill.No multi-player mode has been confirmed by developers. </div>  <div> Plot : During the story segments of the game, the Hulk rescues a teenager named Rick Jones who is tied to the Enclave, a mysterious organization bent on dominating the city with their respective fields of science as their weapons. The Enclave are the primary antagonists in the Incredible Hulk, with others including the U-Foes and the United States Army as they attempt to bring the Hulk down and end his destruction of New York City. The movie's plot with Betty Ross and Emil Blonsky is also included in the story, albeit minimal in comparison. </div> "
Indiana Jones and The Last Crusade: The Graphic Adventure,Tiertex,U.S. Gold,1991,gg,Indiana Jones and The Last Crusade: The Graphic Adventure was developed by LucasArts and is a recreation of the third Indiana Jones film in adventure game form.,3030-14748,14748,0,1989-07-01,https://www.giantbomb.com/indiana-jones-and-the-last-crusade-the-graphic-adv/3030-14748/,," <div> Overview : Indiana Jones and The Last Crusade is a point and click adventure game based on the movie of the same name. While it follows the plot of the film in broad terms, it also adds to existing sequences for the film, or creates new ones altogether, presumably to flesh out the experience. Unlike later LucasArts titles, it is possible for the protagonist to die.The game also features music from John Williams' score to the film. If you didn't have a soundcard this would be limited to short bursts of PC speaker jingles.It was re-released via Steam on July 8th, 2009. </div>  <div> Features : Game manual in the form of Dr. Jones Sr.'s Grail diaryDifferent styles of gameplay: puzzles, boxing, and flyingIndy Quotient (IQ) scoring system, rewarding different solutions to puzzles, and adding replay value </div> "
Iron Man / X-O Manowar in Heavy Metal,Realtime Associates,Acclaim,"October 14, 1996",gg,Intercompany comic hero crossover.,3030-8511,8511,0,,https://www.giantbomb.com/iron-man-x-o-manowar-in-heavy-metal/3030-8511/,ESRB: T,
The Itchy & Scratchy Game,Bits Corporation,Acclaim,1995,gg,"A platformer game based on Itchy &amp; Scratchy, the TV-show-within-a-TV-show on Fox's The Simpsons. Depending on the version, the player either takes control of Itchy the mouse or Scratchy the cat.",3030-15512,15512,0,,https://www.giantbomb.com/the-itchy-scratchy-game/3030-15512/,ESRB: K-A," <div> Overview : The Itchy and Scratchy Game was released in March of 1995, and was published by Acclaim Entertainment. The game stars Itchy and Scratchy from Fox's The Simpsons and retains the comical violence from the TV show. The protagonist is Itchy in the Super Nintendo version, and Scratchy in the Game Gear version. </div>  <div> Gameplay : The Itchy and Scratchy Game is a platforming game, with weapons, and dangerous detours within the levels. Itchy starts out with a mallet, and various weapons are usable later through the game often matching the theme of the level the player is on. There are seven stages in total and all levels have blocked paths that require key items to unlock the path before the player can continue on. Itchy can kill enemies by hitting them with his weapon, though taking too many hits to the health bar can result in his death as well. There is also be a boss battle at the end of each stage, utilizing some sort of puzzle within the fight. </div> "
James Pond 2: Codename: RoboCod,Vectordean,U.S. Gold,1993,gg,"A side-scrolling platform game released in 1991. It is the sequel to the original James Pond, and now parodies RoboCop as well as James Bond.",3030-397,397,0,1991-08-18,https://www.giantbomb.com/james-pond-2-codename-robocod/3030-397/,ESRB: E," <div> Overview : James Pond 2: Codename RoboCod is the second game in the James Pond series, which is also known as Super James Pond. It features the piscine special agent in a new mission at the North Pole. Unlike its free-form predecessor, James Pond 2 is a far more traditional side-scrolling platformer.The game was originally released on the Commodore Amiga, Atari ST and the Sega Genesis in 1991. They were followed with ports to the Amiga CD32, C64, Game Boy, Game Gear, Sega Master System and the Super Nintendo. It has recently received additional graphically enhanced ports for the Nintendo DS, PlayStation 2 and PlayStation Network.There have been multiple publishers for the game. The SNES port alone has three: Victor Interactive Software published the game in Japan, American Softworks in the US and Ocean Software in Europe. EA, US Gold and others have published the game on other systems. </div>  <div> Gameplay : James Pond 2: Codename Robocod is a side-scrolling platformer which is very similar in feel and gameplay to the early Super Mario Bros. games. The player takes on the role of James Pond; a walking fish with body armor who must free all of the Penguins and Toys that the evil Dr. Maybe has captured. In addition to the more traditional elements of platforming, the player has the ability to extend James' body vertically in order to reach platforms and items. He also has access to a number of vehicles throughout the game, such as cars, biplanes and a flying bath. </div>  <div> Trivia : The UK version of the game contains one of the earliest known forms of in-game product placements with the Penguins in the game advertising the ""Penguin"" chocolate bar by McVities.The SNES version of the game was called Super James Pond in North America, whereas in other regions it was called Super James Pond 2.The Playstation, Game Boy Advance and Nintendo DS versions of the game are re-makes rather than ports, with changes to music, level design and art, they are generally considered to be inferior games. </div>  <div> Critical Reception : Electronic Gaming Monthly's Mike Weigand revealed little in his short review of the SNES version of the game other than his review score of 5 out of ten. He wrote, ""...James's ability to make himself tall is quite interesting, but that is really the only special thing about him"". He suggested that fans of the franchise may prefer Aquatic Games. </div> "
Jeopardy!,GameTek,GameTek,1993,gg,An adaptation of the trivia game show for iOS and Android,3030-40143,40143,0,2010-09-22,https://www.giantbomb.com/jeopardy/3030-40143/,,
Jeopardy! Sports Edition,GameTek,GameTek,1994,gg,Answer sports trivia in this adaptation of the popular game show.,3030-23740,23740,0,,https://www.giantbomb.com/jeopardy-sports-edition/3030-23740/,," <div> Overview : Jeopardy! Sports Edition is a competitive quiz game based on the syndicated TV show Jeopardy!. It is functionally similar to the Super Jeopardy video game adaptation made for the SNES and Genesis but with categories and questions focused on sports trivia. Categories range from questions on specific sports, like baseball or football, to various ""pot pourri"" trivia about the world of sports in general.The game was first released on the Sega Genesis in 1993, with additional versions for the Super Nintendo and Nintendo Game Boy the following year. </div> "
Joe Montana Football,BlueSky Software,Sega,1992,gg,"A new Joe Montana Football game for mobile devices, using Unreal Engine 4.",3030-50036,50036,0,,https://www.giantbomb.com/joe-montana-football/3030-50036/,,
Strider Returns,Tiertex,U.S. Gold,1994,gg,"Sequel to Strider made by British developer U.S. Gold in 1990 under license from Capcom USA. Platforms include Sega Genesis, Game Gear and Master System.",3030-23690,23690,0,1992-05-12,https://www.giantbomb.com/strider-returns/3030-23690/,," <div> Critical Reception : When the Genesis version was released in 1993 Electronic Gaming Monthly issued the following review scores, 8,6,6 and 7. Ed Semrad, who issued the highest score wrote, ""...seems to be a longer game [than the first], and the music is above average. A lot of voice is also used. The main problem facing this cart is the fact that the animation is choppy. It seems a lot of the frames are just ported over from the original, and pieced together sloppily"".The review of the Game Gear version from Electronic Gaming Monthly compared the game mostly to the Genesis version and was given scores of 7,7,7 and 7. Donyon Carpenter's comments typify the general mood of the reviewers, ""...very playable and offers some great looking and very involving levels... The screen is very blurry at times because the game moves so fast, but I've seen worse"". </div> "
Judge Dredd,Probe,Acclaim,1995,gg,Judge Dredd,3030-28687,28687,0,,https://www.giantbomb.com/judge-dredd/3030-28687/,,
Junction,Micronet,Micronet,1991,gg,A puzzle game for the Genesis similar to Pipe Dream. The player has to continually shift pathways to direct a red ball around a maze without letting it fall.,3030-69645,69645,0,1990-11-25,https://www.giantbomb.com/junction/3030-69645/,," <div> Overview : Junction is a puzzle game from Micronet under license from Konami (it uses Konami's 1982 arcade game Locomotion as its base) released exclusively for the Sega Genesis and Sega Game Gear platforms.The goal of the game is to direct a red ball around a maze of interchangeable floor tiles with different sets of grooves so that they hit every external ramp around the board. The ball travels around at its own pace, but the player can speed it up temporarily with the B button. Certain obstacles, like the pyramids, interact with the ball in different ways that the player must be careful to observe.  </div> "
Jungle Strike,Unexpected Development,Black Pearl Software,1995,gg,"An isometric action game in which the player controls a Comanche helicopter, a hovercraft, a F117 Nighthawk and an attack bike against the forces of the South American drug-lord Ortega and the Middle-Eastern 'Madman' Kilbaba.",3030-2180,2180,0,,https://www.giantbomb.com/jungle-strike/3030-2180/,," <div> Overview : Jungle Strike is the follow up to Desert Strike and continues the story started in Desert Strike. Players command a variety of aircraft and ground units in order to stop Ibn Kilbaba, the son of General Kilbaba from Desert Strike, and Carlos Ortega, the drug lord, who threaten the United States with nuclear weapons. </div>  <div> Gameplay : The game plays from an isometric perspective and is broken down into specific missions that need to be accomplished on each level. These range from attacking certain locations to recovering items and personnel to defending allied units and buildings. Should any of the objectives result in a failure, the player must restart the level from the beginning. Before each level, players choose a co-pilot to help them, which gives the players semi-automatic to automatic fire on the machine guns. During the missions, fuel, ammunition, and armor all factor into the gameplay and can be recovered by finding related objects in the level. </div>  <div> Story : Ibn Kilbaba, the son of General Kilbaba from Desert Strike, plots his revenge against the United States by allying himself with Carlos Ortega, the drug lord, and announces his dominance by dropping a nuke on an island somewhere in the Pacific. STRIKE quickly send their top agent to secure the President and the surrounding D.C. area against terrorist attack. After securing the President, STRIKE moves to nullify Kilbaba's nuclear capability and control of specific regions. Being pushed back to the mountains, Kilbaba and the Drug Lord put up a strong resistance in their fortress, but are captured and taken back to the United States. However, both are able to escape following an attack on the Capitol. In the end, Kilbaba's escape in a gasoline truck is cut short and the Drug Lord is presumed dead after attempting to flee in a bus. With both leaders out of commission and a nuclear crisis averted in Washington D.C., the world is once again safe from fanatical leaders. </div> "
Jurassic Park,Sega,Sega,1993,gg,Telltale Games continue on from the events of the first Jurassic Park film with this cinematic adventure game.,3030-33851,33851,0,2011-11-15,https://www.giantbomb.com/jurassic-park/3030-33851/,ESRB: T," <div> Overview : Telltale's Jurassic Park: The Game tells a story that opens directly parallel with the story of the first motion picture and deals with the plot points that were abandoned after the 1993 blockbuster film ended. Mainly, Dennis Nedry's Barbasol can of dinosaur embryos, which serves as the opening plot point for the main characters to meet. The timeline of the game occurs both within the film and in the aftermath of the incident, and the player experiences these moments in part from the viewpoint of Jurassic Park's chief veterinarian, Gerry Harding. Other characters include Harding's daughter Jess and other inhabitants of Isla Nublar not seen in the movie, such as scientists, smugglers, or mercenaries. Like recent releases from Telltale Games, Jurassic Park: The Game is broken up into a series of four episodes. However, all four episodes ship with the game, with one easily transitioning to the next without having to purchase the next episode piecemeal. </div>  <div> Gameplay : Telltale Games has said to have been heavily influenced by Heavy Rain's mechanics. The game includes slow-paced investigation sequences where the player pans the camera and initiates sequences where the main character takes closer looks at key places. This is often accompanied with dialogue choices, moving between key locations within the puzzle area, and minor button-mashing sequences. It will also shift to immediate response Quick Time Events when a life or death situation presents itself, such as directional input either solo or in sequences, and also faster button-mashing sequences. If the player is not quick enough to complete the button prompts on the screen, they will either be rewarded with another chance to get the sequence right or with a delightful character death sequence, such as being crushed between the horns of a Triceratops or the jaws of a Tyrannosaurus. Not even young Jess is spared from meeting a demise.There are many cases where a failed Quick Time Event won't immediately render a death screen though. Some will only drain the end Award level for each survival sequence.Gold - Complete all QTEs in the sequence.Silver - Miss one QTE in the sequence.Bronze - Missed three QTEs in the sequence.No Award - Missed five QTEs prompts in the sequence.If the player fails a QTE that results in death, the game will reload to a designated checkpoint where the sequence started, this will cause players to lose one award point. </div>  <div> Story : The story of Jurassic Park: The Game is comprised of four episodes, each being 11 to 12 scenarios long. Each scenario takes place in a different location of the park. Some locations will be familiar to fans of the first Jurassic Park film, such as the Dennis Nedry car scene or the Park's Visitor Center, while other locations will be brand new to both new players and old fans. </div>  <div> System Requirements : The episode opens with Nima Cruz stumbling through the jungle, injured, clutching the Barbasol can and growing more and more delirious. Hired by BioSyn, she's been searching for Dennis Nedry and the can, unaware of the content or even about the kind of animals roaming the park. After surviving an onslaught of Dilophosauruses, she's then been attacked by a different kind of poisonous dinosaur called Troodon and there's a pack of them stalking her as she grows weaker with every step. This is where she's almost run over by a jeep driven by Gerry Harding, on his way back to the visitor's center with his teenage daughter Jess. Unaware of her reasons to be on the island, Gerry lifts her into the car and tries to stabilize her so she can receive treatment. When they make it back to the visitor's center, they enter it just in time to miss the sight of the helicopter carrying off the survivors from the motion picture.With the T-rex still being around, they fight their way to save Nima and survive themselves. Though the situation naturally only gets worse as Nima's desperation to get the can to the North Harbor becomes more apparent. Only minutes after regaining consciousness, she draws a gun on the father and daughter. </div> "
Kawasaki Superbike Challenge,Teque London,Time Warner Interactive,1995,gg,"A Kawasaki-sponsored motorcycle racing game for Genesis, SNES and Game Gear.",3030-1348,1348,0,,https://www.giantbomb.com/kawasaki-superbike-challenge/3030-1348/,ESRB: K-A," <div> Overview : Kawasaki Superbike Challenge (Kawasaki Superbikes in Europe) is a motorcycle racing game that depicts the action from the driver's view. It uses the same tech as the Amiga/Genesis game F1, using sprite scaling to display depth for the various other racers and objects along the race course.The game features fourteen standard tracks as well as the extra-length Suzuki 8 Hours endurance race. The game features the Kawasaki license, but everything else - teams and drivers - are fictional.The game was first released on Sega Genesis in 1994 and was ported to the Game Gear and SNES the following year. </div> "
Klax,Tengen,TengenNADomark EU,1991,gg,Players organize blocks of the same color to make them disappear.,3030-16455,16455,0,,https://www.giantbomb.com/klax/3030-16455/,ESRB: E," <div> Overview : Players line up colored blocks into various patterns to make them disappear. Atari Games originally released it as a coin-op follow up to Tetris, which they were tangled in a legal dispute about at the time.There are actually two Genesis versions of the game. The first, released only in Japan, was ported by Namco who also published the game. The second was the standard Tengen version available on other platforms. </div>  <div> Gameplay : Klax features a conveyor belt at the top of the screen which rolls toward the playing area, delivering a steady supply of colored blocks. The player controls a small device which sits at the interface between the conveyor belt and the playing area. By moving this left and right, the player can catch up to five blocks and deposit them in the playing area. Blocks are dropped in order of recency, with the newest block dropped first. Similarly, the player may launch blocks back up the conveyor belt in an attempt to ""juggle"" them to get the appropriate color ready. </div>  <div> Blob Ball : A Klax is the simplest pattern of three matching blocks. Each pattern is a multiplier based on the number of Klaxes it is worth. Four matching tiles in a row, as an example, are worth two Klaxes. Points are scored based on pattern size. The more blocks which are simultaneously removed, the higher the score. Empty space at the end of the round is also scored. After each round, the player may skip 5 or 10 stages, which results in a higher score multiplier, and more available drops. Difficulty is similarly ramped up faster. Stages have unique challenges, such as forming a specific pattern a number of times (""complete 5 diagonals""). </div> "
